{
  "$schema": "https://json-schema.org/draft/2020-12/schema",
  "$id": "https://schemas.ukma.dev/v1/memory.propose_fact.request.schema.json",
  "title": "memory.propose_fact Request",
  "type": "object",
  "additionalProperties": false,
  "required": [
    "api_version",
    "operation",
    "context",
    "input"
  ],
  "properties": {
    "api_version": {
      "const": "1"
    },
    "operation": {
      "const": "ukma.memory.propose_fact.v1"
    },
    "context": {
      "$ref": "#/$defs/shared.RequestContext"
    },
    "input": {
      "$ref": "#/$defs/wire.ProposeFact"
    }
  },
  "$defs": {
    "wire.MemoryEvidence": {
      "description": "Evidence supporting a claim (\u00a721.1 `provenance_refs`, \u00a734.1).",
      "properties": {
        "confidence": {
          "description": "Confidence the extractor assigned to this piece of evidence.",
          "format": "double",
          "type": "number"
        },
        "evidence_id": {
          "description": "Evidence id.",
          "type": "string"
        },
        "source_group": {
          "description": "Independent source group used for promotion counting (\u00a727.1).",
          "type": "string"
        },
        "source_ref": {
          "description": "Where the evidence came from, for example `artifact:sha256:...`.",
          "type": "string"
        }
      },
      "required": [
        "confidence",
        "evidence_id",
        "source_group",
        "source_ref"
      ],
      "type": "object"
    },
    "wire.MemoryKind": {
      "description": "Which memory store an item lives in (\u00a734.1).",
      "oneOf": [
        {
          "description": "Working memory: session/agent scoped and budgeted.",
          "enum": [
            "working"
          ],
          "type": "string"
        },
        {
          "description": "Episodic memory: TTL and FSRS driven.",
          "enum": [
            "episodic"
          ],
          "type": "string"
        },
        {
          "description": "Semantic memory: versioned, evidence-backed facts.",
          "enum": [
            "semantic"
          ],
          "type": "string"
        },
        {
          "description": "Procedural memory: abstract procedures only, never tool grants.",
          "enum": [
            "procedural"
          ],
          "type": "string"
        }
      ]
    },
    "wire.MemoryRef": {
      "description": "Address of one memory record.",
      "properties": {
        "id": {
          "description": "Memory id.",
          "type": "string"
        },
        "kind": {
          "allOf": [
            {
              "$ref": "#/$defs/wire.MemoryKind"
            }
          ],
          "description": "Store the id belongs to."
        },
        "revision": {
          "description": "Revision or content tag the caller observed.",
          "type": "string"
        }
      },
      "required": [
        "id",
        "kind",
        "revision"
      ],
      "type": "object"
    },
    "wire.ProposeFact": {
      "description": "`memory.propose_fact` (MAPI-10 \u2014 implemented in P6).",
      "properties": {
        "input": {
          "allOf": [
            {
              "$ref": "#/$defs/wire.SemanticFactInput"
            }
          ],
          "description": "Claim to propose."
        }
      },
      "required": [
        "input"
      ],
      "type": "object"
    },
    "wire.SemanticFactInput": {
      "description": "Input of `memory.propose_fact` (\u00a734.1, MAPI-10 \u2014 implemented in P6).",
      "properties": {
        "confidence": {
          "description": "Confidence in `[0,1]`.",
          "format": "double",
          "type": "number"
        },
        "evidence": {
          "description": "Evidence that supports the claim.",
          "items": {
            "$ref": "#/$defs/wire.MemoryEvidence"
          },
          "type": "array"
        },
        "language": {
          "description": "BCP-47 language of the claim.",
          "type": "string"
        },
        "object": {
          "description": "Object of the claim.",
          "type": "string"
        },
        "predicate": {
          "description": "Predicate.",
          "type": "string"
        },
        "subject": {
          "allOf": [
            {
              "$ref": "#/$defs/wire.MemoryRef"
            }
          ],
          "description": "Subject of the claim."
        }
      },
      "required": [
        "confidence",
        "evidence",
        "language",
        "object",
        "predicate",
        "subject"
      ],
      "type": "object"
    },
    "shared.ID": {
      "type": "string",
      "minLength": 1,
      "maxLength": 256
    },
    "shared.ISODate": {
      "type": "string",
      "format": "date-time"
    },
    "shared.Consistency": {
      "enum": [
        "eventual",
        "read_your_writes",
        "snapshot",
        "strict_generation"
      ]
    },
    "shared.ScopeRef": {
      "type": "object",
      "additionalProperties": false,
      "properties": {
        "tenant_id": {
          "$ref": "#/$defs/shared.ID"
        },
        "project_id": {
          "$ref": "#/$defs/shared.ID"
        },
        "repo_id": {
          "$ref": "#/$defs/shared.ID"
        },
        "workspace_id": {
          "$ref": "#/$defs/shared.ID"
        },
        "agent_id": {
          "$ref": "#/$defs/shared.ID"
        },
        "session_id": {
          "$ref": "#/$defs/shared.ID"
        }
      },
      "required": [
        "tenant_id",
        "project_id"
      ]
    },
    "shared.RequestContext": {
      "type": "object",
      "additionalProperties": false,
      "properties": {
        "request_id": {
          "$ref": "#/$defs/shared.ID"
        },
        "trace_id": {
          "$ref": "#/$defs/shared.ID"
        },
        "scope": {
          "$ref": "#/$defs/shared.ScopeRef"
        },
        "principal_id": {
          "$ref": "#/$defs/shared.ID"
        },
        "scopes": {
          "type": "array",
          "items": {
            "type": "string",
            "minLength": 1,
            "maxLength": 128
          }
        },
        "deadline_at": {
          "$ref": "#/$defs/shared.ISODate"
        },
        "consistency": {
          "$ref": "#/$defs/shared.Consistency"
        },
        "required_generation": {
          "$ref": "#/$defs/shared.ID"
        },
        "snapshot_id": {
          "$ref": "#/$defs/shared.ID"
        },
        "idempotency_key": {
          "$ref": "#/$defs/shared.ID"
        },
        "expected_etag": {
          "type": "string",
          "minLength": 1,
          "maxLength": 128
        },
        "delegation_token": {
          "type": "string",
          "minLength": 1,
          "maxLength": 4096
        }
      },
      "required": [
        "request_id",
        "trace_id",
        "scope",
        "principal_id",
        "scopes",
        "consistency"
      ]
    }
  }
}
