{
  "api_version": "1",
  "operation": "ukma.memory.propose_fact.v1",
  "context": {
    "request_id": "x",
    "trace_id": "x",
    "scope": {
      "tenant_id": "x",
      "project_id": "x"
    },
    "principal_id": "x",
    "scopes": [],
    "consistency": "eventual"
  },
  "input": {
    "input": {
      "confidence": 1,
      "evidence": [],
      "language": "x",
      "object": "x",
      "predicate": "x",
      "subject": {
        "id": "x",
        "kind": "working",
        "revision": "x"
      }
    }
  }
}
